{
  "$schema": "./template.lock.schema.json",
  "version": 1,
  "lockedPaths": [
    "template.lock.json",
    "template.lock.schema.json",
    "scripts/check-template-lock.mjs",
    "public/assets/video/granit-decor-kitchen-orbit-v2-desktop-2560.mp4",
    "public/assets/video/granit-decor-kitchen-orbit-v3-mobile-parity-810x1440.mp4",
    "public/assets/video/granit-decor-kitchen-orbit-poster.webp",
    "public/assets/video/granit-decor-kitchen-orbit-v3-mobile-parity-poster.webp",
    "src/components/home-hero-video.tsx",
    "src/components/home-hero.tsx",
    "src/components/site-header.tsx",
    "src/components/site-footer.tsx",
    "src/components/wordmark.tsx",
    "src/components/location-dialog.tsx",
    "src/components/route-scroll-reset.tsx",
    "src/components/reveal.tsx",
    "src/components/button-link.tsx",
    "src/components/section-heading.tsx",
    "src/components/content/page-chrome.tsx",
    "src/app/layout.tsx",
    "src/app/globals.css",
    "src/app/manifest.ts",
    "src/app/robots.ts",
    "src/app/sitemap.ts",
    "next.config.ts",
    "src/styles/tokens.css",
    "src/styles/manifest-pages.css",
    "src/styles/components.css",
    "src/styles/pages.css",
    "src/styles/showroom.css",
    "src/styles/mobile-parity.css",
    "src/template"
  ],
  "replaceableRoots": [
    "src/client",
    "public/client",
    "public/assets/brand",
    "public/assets/materials",
    "public/assets/portfolio"
  ],
  "clientGeneratedPaths": [
    "src/app/**/page.tsx",
    "src/app/**/layout.tsx",
    "src/app/icon.*",
    "src/app/error.tsx",
    "src/app/loading.tsx",
    "src/app/not-found.tsx",
    "src/components/content/**",
    "src/components/materials/**",
    "src/components/planner/**",
    "src/components/functions/**",
    "src/components/site-search-dialog.tsx",
    "src/components/saved-stones-dialog.tsx",
    "src/components/mobile-action-dock.tsx",
    "src/lib/material-storage.ts",
    "src/lib/planner-storage.ts",
    "src/lib/functions/**",
    "src/styles/content-pages.css",
    "src/styles/materials.css",
    "src/styles/planner.css",
    "src/styles/functions/**",
    "public/_redirects",
    "public/assets/projects",
    ".migration/**",
    "tests/client-fixtures/**",
    "ASSET_PROVENANCE.md"
  ],
  "notes": "Locked paths take precedence over generated globs and require an explicit template-level decision. After the migration contract exists, client imports may replace declared roots and regenerate declared client paths."
}
